{
  "$schema": "schemas/ontology.schema.json",
  "schema_version": "3.0",
  "title": "mo:os Superset Ontology v3",
  "description": "Complete categorical ontology for the mo:os Universal Graph Model. Single source of truth for kinds, morphisms, categories, and functors. Contingent instances live in ../instances/.",
  "objects": [
    {
      "id": "OBJ01",
      "name": "User",
      "type_id": "user",
      "broad_category": "identity",
      "description": "Authenticated actor — container whose morphisms grant owned-workspace access edges. No special ontological status.",
      "mutable": true,
      "allowed_strata": [
        "S2",
        "S3"
      ],
      "source_connections": [
        "OWNS",
        "CAN_HYDRATE"
      ],
      "target_connections": [
        "OWNS"
      ]
    },
    {
      "id": "OBJ02",
      "name": "ColliderAdmin",
      "type_id": "collider_admin",
      "broad_category": "identity",
      "description": "Category administrator — elevated actor with governed OWNS edges to assigned containers.",
      "mutable": true,
      "allowed_strata": [
        "S2",
        "S3"
      ],
      "source_connections": [
        "OWNS",
        "CAN_HYDRATE",
        "PRE_FLIGHT_CONFIG"
      ],
      "target_connections": [
        "OWNS"
      ]
    },
    {
      "id": "OBJ03",
      "name": "SuperAdmin",
      "type_id": "superadmin",
      "broad_category": "identity",
      "description": "Root administrator — transitive OWNS over all containers.",
      "mutable": true,
      "allowed_strata": [
        "S2",
        "S3"
      ],
      "source_connections": [
        "OWNS",
        "CAN_HYDRATE",
        "PRE_FLIGHT_CONFIG",
        "CAN_SCHEDULE",
        "CAN_FEDERATE"
      ],
      "target_connections": [
        "OWNS"
      ]
    },
    {
      "id": "OBJ04",
      "name": "AppTemplate",
      "type_id": "app_template",
      "broad_category": "structure",
      "description": "Template container — reusable subgraph pattern. Instantiation = ADD + LINK sequence.",
      "mutable": false,
      "allowed_strata": [
        "S1",
        "S2"
      ],
      "source_connections": [
        "CAN_HYDRATE"
      ],
      "target_connections": [
        "OWNS",
        "PRE_FLIGHT_CONFIG"
      ]
    },
    {
      "id": "OBJ05",
      "name": "NodeContainer",
      "type_id": "node_container",
      "broad_category": "structure",
      "description": "General-purpose container — default object in C. Payload in state_payload JSONB.",
      "mutable": true,
      "allowed_strata": [
        "S2",
        "S3"
      ],
      "source_connections": [
        "OWNS",
        "LINK_NODES",
        "SYNC_ACTIVE_STATE"
      ],
      "target_connections": [
        "OWNS",
        "CAN_HYDRATE",
        "LINK_NODES",
        "ADD_NODE_CONTAINER"
      ]
    },
    {
      "id": "OBJ06",
      "name": "AgnosticModel",
      "type_id": "agnostic_model",
      "broad_category": "compute",
      "description": "LLM/ML model container — provider-agnostic URN. Provider config in state_payload.",
      "mutable": true,
      "allowed_strata": [
        "S2",
        "S3"
      ],
      "source_connections": [
        "CAN_HYDRATE"
      ],
      "target_connections": [
        "OWNS",
        "CAN_SCHEDULE",
        "CAN_ROUTE"
      ]
    },
    {
      "id": "OBJ07",
      "name": "SystemTool",
      "type_id": "system_tool",
      "broad_category": "compute",
      "description": "Tool container — discovered via graph traversal, exposed via MCP protocol surface.",
      "mutable": true,
      "allowed_strata": [
        "S2",
        "S3"
      ],
      "source_connections": [
        "CAN_ROUTE"
      ],
      "target_connections": [
        "OWNS",
        "CAN_HYDRATE",
        "CAN_ROUTE"
      ]
    },
    {
      "id": "OBJ08",
      "name": "UI_Lens",
      "type_id": "ui_lens",
      "broad_category": "surface",
      "description": "UI rendering surface — functor output: containers × wires → React component tree.",
      "mutable": false,
      "allowed_strata": [
        "S4"
      ],
      "source_connections": [
        "SYNC_ACTIVE_STATE"
      ],
      "target_connections": [
        "OWNS",
        "CAN_HYDRATE"
      ]
    },
    {
      "id": "OBJ09",
      "name": "RuntimeSurface",
      "type_id": "runtime_surface",
      "broad_category": "surface",
      "description": "Execution surface — HTTP/WS/MCP endpoint. Tools wire here to become executable.",
      "mutable": true,
      "allowed_strata": [
        "S2",
        "S3"
      ],
      "source_connections": [],
      "target_connections": [
        "OWNS",
        "PRE_FLIGHT_CONFIG",
        "CAN_ROUTE"
      ]
    },
    {
      "id": "OBJ10",
      "name": "ComputeResource",
      "type_id": "compute_resource",
      "broad_category": "compute",
      "description": "GPU device, Docker container, thread pool, VM — schedulable resource container.",
      "mutable": true,
      "allowed_strata": [
        "S2",
        "S3"
      ],
      "source_connections": [
        "OUTBOUND",
        "BRIDGE"
      ],
      "target_connections": [
        "OWNS",
        "CAN_SCHEDULE",
        "INBOUND",
        "BRIDGE"
      ]
    },
    {
      "id": "OBJ11",
      "name": "ProtocolAdapter",
      "type_id": "protocol_adapter",
      "broad_category": "protocol",
      "description": "WS channel, MCP session, gRPC stream, HTTP endpoint — routable communication container.",
      "mutable": true,
      "allowed_strata": [
        "S2",
        "S3"
      ],
      "source_connections": [
        "CAN_ROUTE"
      ],
      "target_connections": [
        "OWNS",
        "CAN_HYDRATE"
      ]
    },
    {
      "id": "OBJ12",
      "name": "InfraService",
      "type_id": "infra_service",
      "broad_category": "infra",
      "description": "Postgres instance, disk volume, network segment — persistable infrastructure container.",
      "mutable": true,
      "allowed_strata": [
        "S2",
        "S3"
      ],
      "source_connections": [
        "OUTBOUND",
        "BRIDGE"
      ],
      "target_connections": [
        "OWNS",
        "CAN_PERSIST",
        "INBOUND",
        "BRIDGE"
      ]
    },
    {
      "id": "OBJ13",
      "name": "MemoryStore",
      "type_id": "memory_store",
      "broad_category": "memory",
      "description": "Vector embedding store, context window, conversation history — ephemeral or persistent memory container.",
      "mutable": true,
      "allowed_strata": [
        "S2",
        "S3",
        "S4"
      ],
      "source_connections": [
        "CAN_HYDRATE",
        "OUTBOUND",
        "BRIDGE"
      ],
      "target_connections": [
        "OWNS",
        "CAN_PERSIST",
        "INBOUND",
        "BRIDGE"
      ]
    },
    {
      "id": "OBJ14",
      "name": "PlatformConfig",
      "type_id": "platform_config",
      "broad_category": "platform",
      "description": "Platform distribution configuration — paths, store mode, build targets. Typed representation of distribution.json entries.",
      "mutable": true,
      "allowed_strata": [
        "S2",
        "S3"
      ],
      "source_connections": [],
      "target_connections": [
        "OWNS",
        "PRE_FLIGHT_CONFIG"
      ]
    },
    {
      "id": "OBJ15",
      "name": "WorkstationConfig",
      "type_id": "workstation_config",
      "broad_category": "platform",
      "description": "Workstation environment descriptor — OS, runtime ports, optional services. Typed representation of workstation.json entries.",
      "mutable": true,
      "allowed_strata": [
        "S2",
        "S3"
      ],
      "source_connections": [
        "OUTBOUND",
        "BRIDGE"
      ],
      "target_connections": [
        "OWNS",
        "PRE_FLIGHT_CONFIG",
        "INBOUND",
        "BRIDGE"
      ]
    },
    {
      "id": "OBJ16",
      "name": "Preference",
      "type_id": "preference",
      "broad_category": "config",
      "description": "Runtime preference — key-value wire_config with scope (system/workspace/user/session). Typed representation of preferences.json entries.",
      "mutable": true,
      "allowed_strata": [
        "S2",
        "S3"
      ],
      "source_connections": [],
      "target_connections": [
        "OWNS"
      ]
    },
    {
      "id": "OBJ17",
      "name": "Provider",
      "type_id": "provider",
      "broad_category": "compute",
      "description": "LLM/AI provider container — adapter_type, API config, rate limits. OWNS model containers (OBJ06). Typed representation of providers.json entries.",
      "mutable": true,
      "allowed_strata": [
        "S2",
        "S3"
      ],
      "source_connections": [
        "OWNS"
      ],
      "target_connections": [
        "OWNS"
      ]
    },
    {
      "id": "OBJ18",
      "name": "BenchmarkSuite",
      "type_id": "benchmark_suite",
      "broad_category": "evaluation",
      "description": "Named benchmark collection — groups BenchmarkTask entries. Definition object, immutable after creation.",
      "mutable": false,
      "allowed_strata": [
        "S2"
      ],
      "source_connections": [
        "OWNS"
      ],
      "target_connections": [
        "OWNS",
        "BENCHMARKED_BY"
      ]
    },
    {
      "id": "OBJ19",
      "name": "BenchmarkTask",
      "type_id": "benchmark_task",
      "broad_category": "evaluation",
      "description": "Individual benchmark task definition — prompt template, expected morphisms, difficulty. Immutable after creation.",
      "mutable": false,
      "allowed_strata": [
        "S2"
      ],
      "source_connections": [],
      "target_connections": [
        "OWNS",
        "EVALUATES_TASK"
      ]
    },
    {
      "id": "OBJ20",
      "name": "BenchmarkScore",
      "type_id": "benchmark_score",
      "broad_category": "evaluation",
      "description": "Benchmark result record — model’s scores on a task within a suite. Immutable once recorded. Sources MOR14/15/16.",
      "mutable": false,